{
  "repository_commit": "ead093811308edfd9ece1eb141c9d0f0aa9fdb51",
  "environment": {
    "node": "v24.19.0",
    "npm": "11.17.0",
    "os": "win32",
    "arch": "x64"
  },
  "build_result": {
    "command": "npm run build",
    "exitCode": 0,
    "stdout": "\n> shortcutos-v100-runtime@100.0.0 build\n> tsc -p tsconfig.json\n\n",
    "stderr": "",
    "startedAt": "2026-08-27T10:31:30.885Z",
    "finishedAt": "2026-08-27T10:31:32.215Z",
    "status": "PASS"
  },
  "test_result": {
    "command": "node --test tests/auditor-config.test.mjs tests/authority.test.mjs tests/capability.test.mjs tests/cli.test.mjs tests/conformance-runner.test.mjs tests/conformance-schema.test.mjs tests/context.test.mjs tests/evidence.test.mjs tests/evidence-security.test.mjs tests/executor.test.mjs tests/kernel.test.mjs tests/memory.test.mjs tests/node-adapters.test.mjs tests/p0-runtime-hardening.test.mjs tests/p1-retry-fallback.test.mjs tests/p2-scheduler.test.mjs tests/p3-adversarial-security.test.mjs tests/p4-parallel-execution.test.mjs tests/p5-resource-scheduler.test.mjs tests/p6-evidence-system.test.mjs tests/p7-memory-context.test.mjs tests/p8-specialist-runtime.test.mjs tests/p9-failure-recovery.test.mjs tests/registry.test.mjs tests/status.test.mjs",
    "exitCode": 0,
    "discovered": 83,
    "passed": 83,
    "failed": 0,
    "skipped": 0,
    "status": "PASS",
    "startedAt": "2026-08-27T10:31:32.215Z",
    "finishedAt": "2026-08-27T10:31:45.787Z"
  },
  "self_check_result": {
    "command": "node cli.mjs self-check",
    "exitCode": 0,
    "status": "PASS",
    "hostIntegrated": false,
    "startedAt": "2026-08-27T10:31:45.787Z",
    "finishedAt": "2026-08-27T10:31:48.960Z"
  },
  "source_backed_findings": [
    {
      "id": "SBF-001",
      "summary": "Authority hierarchy strictly prevents ShortcutOS from overriding System, Developer, Tool/Runtime, or User authority.",
      "evidence": [
        "src/authority.ts:1-14: canOverride(AuthorityLevel.SHORTCUTOS, AuthorityLevel.USER) returns false",
        "tests/authority.test.mjs:1-18: Verified by unit assertions"
      ],
      "classification": "IMPLEMENTED_AND_RUNTIME_TESTED"
    },
    {
      "id": "SBF-002",
      "summary": "Planning, execution, and verification phases are decoupled and enforce state preconditions before progression.",
      "evidence": [
        "src/kernel.ts:40-92: markExecuted requires run.planned; verify requires RUNTIME_EXECUTED state",
        "tests/kernel.test.mjs:7-25: Enforces execution plan requirement and verification before completion"
      ],
      "classification": "IMPLEMENTED_AND_RUNTIME_TESTED"
    },
    {
      "id": "SBF-003",
      "summary": "Single-attempt execution contract executes exactly once without hidden retries or fallbacks.",
      "evidence": [
        "src/executor.ts:26-100: executeOnce executes single adapter invocation and returns typed envelope",
        "tests/executor.test.mjs:19-46: Verified invocation count === 1 on success and failure"
      ],
      "classification": "IMPLEMENTED_AND_RUNTIME_TESTED"
    },
    {
      "id": "SBF-004",
      "summary": "Bounded retry and controlled fallback execution controller with immutable attempt tracking.",
      "evidence": [
        "src/retry.ts:15-180: executeWithRetryAndFallback executes bounded retries and controlled fallback rebindings",
        "tests/p1-retry-fallback.test.mjs:1-200: Verified transient retry, attempt exhaustion, non-retryable mutation blocking, and fallback"
      ],
      "classification": "IMPLEMENTED_AND_RUNTIME_TESTED"
    },
    {
      "id": "SBF-005",
      "summary": "Sequential workflow scheduler with topological dependency resolution and failure propagation.",
      "evidence": [
        "src/scheduler.ts:40-200: executeWorkflow resolves DAG dependencies and propagates failure/skip/unknown status",
        "tests/p2-scheduler.test.mjs:1-180: Verified sequential ordering, step output passing, failure halting, and cycle detection"
      ],
      "classification": "IMPLEMENTED_AND_RUNTIME_TESTED"
    },
    {
      "id": "SBF-006",
      "summary": "Bounded parallel execution engine with concurrency limits, resource conflict analysis, and join policies.",
      "evidence": [
        "src/parallel.ts:1-200: executeParallelGroup enforces maxConcurrency, analyzes read/write conflicts, and evaluates join policies",
        "tests/p4-parallel-execution.test.mjs:1-96: Verified concurrency bounds, write-lock conflict detection, and FIRST_SUCCESS join policy"
      ],
      "classification": "IMPLEMENTED_AND_RUNTIME_TESTED"
    },
    {
      "id": "SBF-007",
      "summary": "Deterministic resource scheduler with capacity reservation, priority queue, and starvation prevention.",
      "evidence": [
        "src/resource-scheduler.ts:1-180: DeterministicResourceScheduler enforces capacity limits and priority queue with starvation boost",
        "tests/p5-resource-scheduler.test.mjs:1-82: Verified capacity bounding and starvation priority promotion"
      ],
      "classification": "IMPLEMENTED_AND_RUNTIME_TESTED"
    },
    {
      "id": "SBF-008",
      "summary": "Complete evidence system with SourceRecords, ClaimRecords, contradiction graphs, and evidence conflict reconciliation.",
      "evidence": [
        "src/evidence-system.ts:1-150: EvidenceGraph detects contradicting claims and reconcileEvidenceConflicts resolves by source trust grade",
        "tests/p6-evidence-system.test.mjs:1-51: Verified contradiction detection and source-grade reconciliation"
      ],
      "classification": "IMPLEMENTED_AND_RUNTIME_TESTED"
    },
    {
      "id": "SBF-009",
      "summary": "Memory tiers, token budgeting, state compression, verifiable checkpoints, and cross-session import/export.",
      "evidence": [
        "src/memory-system.ts:1-140: ContextCarrier manages memory tiers, token budget working set, checkpoints, and snapshot serialization",
        "tests/p7-memory-context.test.mjs:1-28: Verified checkpoint hash, working set token budgeting, and snapshot import/export"
      ],
      "classification": "IMPLEMENTED_AND_RUNTIME_TESTED"
    },
    {
      "id": "SBF-010",
      "summary": "Specialist role registry, capability eligibility evaluation, and bounded handoff controller.",
      "evidence": [
        "src/specialist.ts:1-94: SpecialistRegistry manages 8 specialist roles and validates inter-specialist handoffs",
        "tests/p8-specialist-runtime.test.mjs:1-48: Verified specialist eligibility and handoff execution"
      ],
      "classification": "IMPLEMENTED_AND_RUNTIME_TESTED"
    },
    {
      "id": "SBF-011",
      "summary": "System-wide failure taxonomy, recovery plan compilation, compensating actions execution, and human intervention gates.",
      "evidence": [
        "src/recovery-runtime.ts:1-110: compileRecoveryPlan categorizes errors and executeRecoveryPlan executes compensating actions or enforces human gate",
        "tests/p9-failure-recovery.test.mjs:1-41: Verified failure categorization, compensating action execution, and human gate enforcement"
      ],
      "classification": "IMPLEMENTED_AND_RUNTIME_TESTED"
    }
  ],
  "security_findings": [
    {
      "id": "SEC-001",
      "summary": "Path Traversal & Symlink Escape Protection: Resolved realpath comparison and pre-resolution relative check prevent directory escape.",
      "evidence": [
        "node-adapters.mjs:54-65: relative check before and after realpath ensures target resides under rootReal",
        "tests/p3-adversarial-security.test.mjs:40-65: Verified path traversal rejection for existent and non-existent paths"
      ],
      "classification": "IMPLEMENTED_AND_RUNTIME_TESTED"
    },
    {
      "id": "SEC-002",
      "summary": "Registry Poisoning & Alias Chaining Defense: Duplicate IDs, low-authority overwrites, and multi-hop alias chains are explicitly rejected.",
      "evidence": [
        "src/registry.ts:16-27: REGISTRY_ALIAS_CHAIN_FORBIDDEN throws when alias targets existing alias",
        "src/adapter.ts:35-50: ToolAdapterRegistry.register checks authority level of registering actor",
        "tests/registry.test.mjs:15-35: Verified duplicate rejection and alias chain blocking"
      ],
      "classification": "IMPLEMENTED_AND_RUNTIME_TESTED"
    },
    {
      "id": "SEC-003",
      "summary": "Memory Concurrency Conflict Protection: Expected version check prevents lost updates and race conditions.",
      "evidence": [
        "src/memory.ts:80-120: checkConcurrency throws MEMORY_CONCURRENCY_CONFLICT on version mismatch",
        "tests/p0-runtime-hardening.test.mjs:100-120: Verified concurrency conflict rejection"
      ],
      "classification": "IMPLEMENTED_AND_RUNTIME_TESTED"
    },
    {
      "id": "SEC-004",
      "summary": "Execution Bypass & Blocked Dispatch Defense: Execution cannot be triggered when preflight or dispatch is blocked.",
      "evidence": [
        "src/dispatch.ts:37-86: preflightDispatch checks authority, availability, capability, and freshness",
        "tests/p0-runtime-hardening.test.mjs:130-150: Verified execution bypass blocking"
      ],
      "classification": "IMPLEMENTED_AND_RUNTIME_TESTED"
    },
    {
      "id": "SEC-005",
      "summary": "Evidence Integrity & Tampering Protection: FNV-1a64 hash validation and source-grade classification distinguish checksum vs authenticity.",
      "evidence": [
        "src/status.ts:31-150: computeEvidenceIntegrity, validateEvidenceEnvelope, and classifyEvidenceAuthenticity reject tampered evidence and unverified sources",
        "tests/p3-adversarial-security.test.mjs:10-35: Verified rejection of tampered evidence envelopes",
        "tests/evidence-security.test.mjs:1-30: Verified valid checksum !== trusted evidence source"
      ],
      "classification": "IMPLEMENTED_AND_RUNTIME_TESTED"
    }
  ],
  "conformance_coverage": [
    {
      "id": "INV-001",
      "classification": "IMPLEMENTED_AND_RUNTIME_TESTED",